"POSITIVE", "Size - The most notable feature, that most of you who are reading this are wanting, is that it is very slim and lightweight. For a 13' Ultrabook, only weighing in at about 3 lbs is a great convenience to me as I tend to carry around many textbooks with me to my classes. Adding a 5lbs laptop to that mix and my back just wants to die. It is the perfect size for taking it around while also having a large enough screen to be productive. Aesthetics - If you've seen any of the previous Zenbooks then you've seen all there is to see, and by this I mean it looks absolutely gorgeous. With its slim profile, metal body and spiral design on the lid, it is a classy looking piece of hardware that will look good wherever you go. They even include what looks like a portfolio folder to sleeve your Zenbook in. Screen - Right away before you even turn it on, you will notice its matte screen. It does an excellent job of ridding the screen of glare so you can definitely use this laptop outdoors. Once you turn it on, colors are crisp and clean. With the full 1920x1080 resolution, everything looks very sharp and it is a great pleasure to use. Some people may be concerned that an HD resolution on a 13.3' screen might be a problem as text will be too small. For me, it isn't a problem as I can still read things clearly and if I do find something too small I can always zoom in on the text to read, which is a very simple task might I add that leads me into... Trackpad - The trackpad, it is generously sized which I definitely enjoy. It is responsive and is definitely usable, however I wouldn't call it the best trackpad I've ever used. Even so, with the added multi touch gestures that are included with the Asus software, it makes up for what little problems it has. Two finger swipes are for scrolling in whichever direction you want. Three finger swipes left and right are for forward and backwards in applications, down to minimize all/show desktop, up to open Aero Flip which I have more to talk about later in the other thoughts. Then of course there is pinch to zoom as well, which makes everything significantly easier to work with if you find something too small to zoom in on it. Other than that, other things to note are the entire trackpad is a single button and is basically a big left click with the exception of the bottom right of the trackpad which is the right click. Keyboard - Fairly standard chicklet key style keyboard, function keys running along the top for all your media and wireless, brightness settings and what nots. If you've used any of Asus' keyboards in the past it will feel very familiar to you and I definitely like it. Arrow keys are a bit small if that bothers you. Speakers - Volume is pretty good at max, they are definitely loud but they definitely won't break any eardrums. Sound clarity is impressive to me, I'm no audiofile so I have much lower standards but they definitely aren't tinny. Performance - I'll get to that in the other though"
"POSITIVE", "The field is EXTREMELY narrow for a combination of: Ultrabook, discrete graphics, and true HD display. It's just this and maybe one or two other options -- laughable."
"POSITIVE", "Great ultrabook if your not super picky like majority of the reviews on this page. No dead pixels, no light bleed, keyboard and track pad are great. No insufficient or cosmetic problems. No overheating and I have maxed everything on here for high performance benchmark speed tests. Overall its a great lightweight, portable machine. I wiped windows 8 clean and installed Ubuntu 13.4 and all drivers work out of box. A couple minor tweaks but that is it. I couldn't be more happier."
"POSITIVE", "Super light. Great screen. Love the keyboard. Touchpad works great."
"POSITIVE", "Works well with linux, fantastic screen, very comfortable keyboard, really great trackpad, LIGHT!, and fairly cool."
"POSITIVE", "the whole laptop is a pro except the windows 8 which im use to windows 7 so its an adjustment oh and ontop the laptop stand thats included! i mean seriously?! all you do is take the laptop foam and cut off the two pieces like the box says and boom there you go! oh and i forgot the dual may i say dual! video cards!!"
"POSITIVE", "I am a new owner who has done some moderate testing with random games, browsing and other tasks. I'm going to be doing some traveling for about 2 months and wanted to take something with me that I could play the same games that I play on my PC. I read quite a few reviews about the i7 version and wasn't fully convinced it was worth the additional cost. Honestly, I think I was right. The games I've played through Steam (Skyrim, Fallout New Vegas, StarCraft, and FarCry 3) have all played perfectly. Off course there was some, and I mean some, stutter. I'm not too much of an FPS addict, but it played everything smoothly where it didn't distract from game play. The i5 and SLI combination work awesomely together. Windows 8 isn't actually as bad as people say. Give it some time, you'll learn it. I can't think of a reason I would spend more money to pick up a copy of 7 and replace it. The hard drive isn't as slow as people say. Or maybe it is. I guess it's relative. Sure, if you're used to SSDs it's going to be slow as hell. I run an SSD in my PC and I didn't expect my laptop to be as speedy. If you need ridiculous speed replace the HDD. As for me, I'm fine with it. Though, I wouldn't mind seeing a smaller HDD with some SSD caching. That'd be my ideal. The screen is full HD and ridiculously color accurate for a even a $1400+ laptop. Easily the best I've seen. The glossy screen is a bit annoying but does provide better color accuracy and contrast...as long as you're not sitting in a room of bright florescent lights. The keyboard rocks. I thought I'd hate it and end up using my standard keyboard instead. Not the case. The keys are comfortable, easy to clean and easy to type on. You can also easily control sound output, brightness and more with ease. And they glow. Boom. Noise? Not much. If it every becomes an issue I'll use headphones."
"POSITIVE", "Great customer service."
"POSITIVE", "Sleek, thin, 4hr+ battery, stretchable to 5hr if properly tempered new battery's charge full/drain full cycle in the first few weeks of use. i5 3317U 8GB ram Intel HD 4000 runs games up to 2011. Skyrim 1280x720, High Texture, no Shadow/AA runs @ 25~35fps (playable) WoW autodetect @ 45+fps 5GB Mix Content File Xfer @ 30mbps (ultrabook average)"
"POSITIVE", "For an ultrabool of the same spec would cost double from name brands. Works fine out of the box and previous review of standby/sleep error can be taken with a grain of salt. Works great and fast off boot and sleep. Skyrim on 1280x720 with high texture no shadow no AA plays at 25~35fps with the i5 turbo autoswitch (great bang for your bucks)."
"POSITIVE", "Nice hardware, good bang for buck."
"POSITIVE", "Sleek, fast, and everything you need from a laptop. Track pad works well with win 8 gestures. Screen is pretty good but doesnt have the greatest viewing angle. Speakers are surprisingly loud."
"POSITIVE", "All aluminum frame, almost same exact specs as a $1,600 MacBook pro. Performance is nearly flawless. Pretty responsive track pad. All other brands with same specs are way higher priced. Keyboard is pretty decent as well. Screen is extremely crisp and clear."
"POSITIVE", "The 1080p IPS screen is simply outstanding, with close to 180° viewing angles both vertically and horizontally. The dual-core Core i7 3517U outperforms many older quad-core CPUs. The GeForce GT 620M is surprisingly fast; it's about 100% faster on gaming benchmarks than the integrated HD 4000. It gets close to 50 FPS in DiRT 3 at 1280x720 with all settings set to high running the built-in benchmark (about 25 FPS at 1920x1080). Here are the Windows Experience Index numbers (Windows 7) Processor: 7.1 Memory: 7.8 2D Graphics: 5.7 3D Graphics: 6.6 Hard Disk: 5.9 The hard drive was another pleasant surprise. The SSD cache makes a huge difference. I wiped out Windows 8 and installed Windows 7. The software that enables the cache was one of the last items I installed, so I got to use the drive both with and without the cache. Windows 7 took 90 seconds to boot without the cache. That time was reduced to an amazing 18 seconds after the cache was enabled. Programs launch almost instantaneously, just like they do with an SSD. I would choose this drive over a 256 GB SSD drive even if they were priced the same."
"POSITIVE", "Nice high def screen. 6 Gig of memory. I7 processor. Mouse touch pad works nice. I set up a W8 for a lady last week and this went a lot smother. There seemed to be more on the desktop to use than there was on her machine. They put a small edge sticking out to get the top open finally. The lighted keyboard is nice. Looks sharp in the dark. Screen is excellent . My USB stick works in this one with no trouble. I had a similar model I could not get the USB port to function all the time. Good machine but not perfect."
"POSITIVE", "Very fast, thin, light and the screen is phenomenal. The HD4000 with quick-sync technology encodes video VERY fast with applications that support it."
"POSITIVE", "Best ultrabook on the market, super thin, super mobile, super light, high quality, its an Asus, really pretty,"
"POSITIVE", "Very Thin, 1920x1080 resolution"
"POSITIVE", "Nice screen (-backlight bleed)"
"POSITIVE", "OVERALL: The specs are obviously fantastic, especially for the price. Quite aside from being the cheapest 650M laptop, this machine has two (and it only costs you the basically useless optical drive). DISPLAY: The display is excellent. Viewing angles are good to very good - I'm not sure if the laptop actually has an IPS panel, but if it isn't IPS/PVA/PLS it's the best TN I've ever seen. KEYBOARD: The keyboard has a nice, solid feel and good action. Travel is nice. There's no 'hidden tray' underneath it to suck up dust, which is a nice touch. PERFORMANCE: Haven't really had a chance to run the gamut on this. I upgrade the RAM to 8 GB of major name-brand out of the box. In my machine at least, Lenovo inserted the 4 GB stick (ie, the larger stick) on the top port meaning an upgrade from 2GB-4GB for the second stick requires removing both. The laptop only has two SODIMM slots, so you're limited to 16 GB which is a slight disappointment given the weight, but not the dimensions. INTERNAL LAYOUT: To get access to the innards you need to unscrew quite a few screws (more than 5, I think the number is 7 or 8) and life the entire rear panel off. It also doesn't like to 'snap' back into place. It was definitely a tense moment trying to pry it out of the 'snap' slots. With the battery at the top and the laptop upside down facing you, the clockwise part arrangement is CPU/GPU1 + Heatpipe (right side), 2x SODIMM Slots bottom right, Wireless card (Intel 6325 if I'm not mistaken) (middle), 1TB HDD (bottom left), GPU2 (left side). The second GPU is removable (Lenovo calls it an 'Ultra Bay' - presumably some kind of advanced technology oceanic/land formation) with a switch on the bottom-center of the laptop that doesn't latch, but is flush with the bottom. It takes a *lot* of force to pry the GPU out of the slot, so while the ease of moving the switch was a little disconcerting at first, I was actually afraid I was missing some screws somewhere before I successfully pulled it out. It *does not* screw in. The HDD is easily and readily user replaceable - there are two screws holding in the 2.5' caddy. The caddy has a 4-screw metal foil shield over it (I didn't remove this, but it looked pretty straightforward). The laptop uses standard mSATA interface, so it's ripe for replacement. Drive comes with an ~25 GB recovery partition, and then ~900 GB of space for you after the install. The slowest overall component in the WEI is the HDD so this one's ripe for replacement. There is only one drive slot in the machine, so you're going to be trading space for speed (but who honestly needs 1TB in a laptop anyways?). EXTERIOR: The lid is aluminum with a nice texture - the texture makes it feel more plasticy, but it definitely is metal. The entire bottom of the enclosure is plastic, SPEAKERS: The speakers really surprised me with how good they actually sound. Much better than expected."
"POSITIVE", "I was looking for a laptop similar to the latest gen MacBook Pro, and finally found this. If I had unlimited amounts of money to spend, I probably would have bought the Mac before finding this. Thankfully, I don't have endless stacks of cash because I would have missed this! Screen: High resolution with a dpi very close to a mac Video: NVidia SLI. It has plenty of power for all the steam games I have on my PC Backlight in the keyboard Windows 8: (I was going to immediately dump 8 for 7 upon receiving this, but after 15 minutes of 8, I love it! Why did I and other people hate 8 so much? Not sure.) PRICE: $899? You have to be kidding me. Buy this now and keep it for the next 5 years. You will save over $1,400.00 buy not buying a mac book pro or ultrabook."
"POSITIVE", "Super fast: i5 with turbo boost, 8GB of ram, Intel HD 4000 graphics, 32 GB of SSD drive and Windows 8 make it a super fast machine. Boot and shut down times are just insane. Not to mention always cool to the touch. Beautiful: What a solid piece of beauty this machine is. And less than 4lbs? Speechless. Not to mention the gorgeous and crisp screen that works exceptionally well even in the bright sunlight (with the brightness cranked to 100%). Other than the AVATAR logo, this machine has no flaw/s when it comes to build quality and looks. I kid. Love AVATAR for creating this affordable wonder. Battery: It depends on the brightness and the power plan you set this beauty at. I for example keep the brightness at around 40% and the power plan at Performance, and still get close to 6 hours out of this beauty. A lot of HD Youtubing, mind you."
"POSITIVE", "- Sturdy and well built. I can pick it up from the corner with the screen open and there is no flex at all. - Keyboard is perfect - Large Multitouch trackpad is great - I was worried about the small power connector, but it is very sturdy and has a nice solid connection - Very fast with the Core i5, 8Gb Ram, and SSD. Resumes from sleep in ~3sec."
"POSITIVE", "It looks cool."
"POSITIVE", "I bought this ultrabook for school because it's light and has enough power to run the programs I need. I was worried about buying an unknown name but it was well worth it. The track pad is okay and the keyboard works great. Very similar to the Macbook pro. Very fast and hasn't overheated on me once. Seems like a sturdy computer and the screen is a good size. All in all, I love it."
"POSITIVE", "Shipped quickly, fast setup, everything connected correctly."
"POSITIVE", "Lightweight, well build, looks great. Runs everything we want, and probably more as stuff comes out. We got this as a replacement for a less than desirable laptop used for gaming. No problems at all yet."
"POSITIVE", "got to my house in 2 days I have had no speed problems it's easy to tweak plenty of fan slots runs planetside 2 with no problems and fallout new Vegas on max"
"POSITIVE", "Runs Anything i throw at it, Was able to adjust the fan speed, Runs GTA4 Etc."
"POSITIVE", "- Works right out of the box, no problems what so ever - Very quiet, along with a nice sleek look and cool LED lights. - Decent GPU, might want to upgrade in the future. Still good. -16GB of RAM.... Well played."
"POSITIVE", "stop looking and start buying!!! you will not find a better system for under $700 read jkteddy77 he sums it up quite nicely."
"POSITIVE", "First, the heat problem people always complain can be alleviated very easily. Turn the power setting from full performance to energy saver. I was surprise how much cooler now my Ultrabook is. Wii is still erratic. Turn off the energy management of the wifi adapter. IT helps some. Nothing you can do to strengthen the reception. The ports are flimsy. SO treat them like virgins. The tracking pad is still not as good as Macbook Air but I dislike Macbook Air'screen. Nice escreen"
"POSITIVE", "Gorgeous display, lightweight, nice keyboard."
"POSITIVE", "Screen, light, portable"
"POSITIVE", "Gorgeous screen, lightning fast boot times, nice keyboard, long battery life."
"POSITIVE", "3dMark 11 results of 6544 3dMarks, Graphics Score 10912, Physics Score 2726 on a Notebook that costs $900. I've tested DOTA 2 and TF 2 with everything maxed and it ran smooth as glass. The speakers are really good and can be used as your only gaming speakers. Not a fan of Glossy screens, but this one looks really good."
"POSITIVE", "Awesome specs for the price of 899. SLI graphics. Fast computer awesome running all games that I've got."
"POSITIVE", "Nvidia gt650m x 2 has played every-game I've tried max settings at 1080p at ease. very solid, nice backlit kb, synaptics touchpad 1080p with nice detail no dead pixels, very nice speakers on par with hp's beats audio and these sound more clear imo"
"POSITIVE", "After using Windows 8 (which I hate) I found that installing windows 7 was really easy. Most of the drivers can be found on Intels website (the wireless is the Centrino-N) look for the file Wireless_15.3.1_Ds64.exe from Intel. The rest was easy to find (including the ELAN drivers for the touchpad). Things to note: Don't bother with the Intel Rapid Storage stuff (I couldn't get the hard drive accelerated anyway for whatever reason). Instead get your windows 7 USB or CD ready and destroy the RAID group. Then go into the BIOS and change it from RAID to AHCI. Then install windows 7 to the SSD drive. Move the page file to the secondary drive (the 466GB drive) and bam the machine screams. Why bother caching when 32gb is enough for the entire operating system? All of the drivers save for the ACPI (which you don't need) are easily found on the web. I have to say, this is the best Ultrabook I have found for this price, and after my install of windows 7, its performance is awesome."
"POSITIVE", "Thin, Light, Keyboard, Speed, Stays Cool, and Battery Life"
"POSITIVE", "Very Thin, Light, Price, Fast, and Stays Cool"
"POSITIVE", "-Sleek -Thin -Portable -Design -Price!"
"POSITIVE", "Light, good specs"
"POSITIVE", "This computer is amazing. It runs allof my games flawlessly and on the highest settings. Whether it's Skyrim, WoW, Fall Out, or anything. I love it. Windows 8 takes some getting used to, but once you do, it's not nearly as bad as what people say. I love it."
"POSITIVE", "Didn't really get to see any..."
"POSITIVE", "For the Price, this is definitely the gaming computer anyone who's looking into gaming should buy -very quiet computer - amazing RAM space - runs all my high end games mostly on high- ultra settings, some video lag on ultra running Skyrim, Battlefield 3, Crysis 3, but meh, it's to be expected. - lots of upgrade possibilities, planning to swap out the GPU and power supply for better ones, and add some liquid cooling + more Fans. :) -Windows 8 is amazing, forget what you see about the negative comments about Windows 8, usually those are the people who don't understand how to adapt to change, but after a day or two, I got used to Windows 8, especially the Start screen and how you can split screen with different programs. I like."
"POSITIVE", "- Very Fast/Responsive - Comes with tuning software already installed so you can monitor your power or overclock your cpu (Although I wouldn't recommend it with this setup) - Clean and simple design - HDMI on video card - Arrived the day after I ordered it and I only paid $10 for regular ground shipping"
"POSITIVE", "none so far"
"POSITIVE", "Light weight. Long battery. Powerful for it's size."
"POSITIVE", "Lightweight, very fast start up from sleep, long battery life, does not heat up like Macs, 1080p. On paper it is awesome."
"POSITIVE", "nothing has gone wrong so far. works as advertised. nice screen. no issues of scratching or fragile ports as others have complained of, though i have been gentle with the unit."
"POSITIVE", "Nice screen. Light and thin enough to fit in my passenger's bag. The extra pixels really make a difference. I had a Macbook Air. Don't get me wrong. I loved the Macbook Air. Mac OS is fun and intuitive to use (and I have always been using PC), the Mac keyboard and trackpad are awesome. I just couldn't get used to the screen resolution, and that was no why I would pay extra $500 for the retina display. $500 for the retina display."
"POSITIVE", "This ultrabook packs an AMAZING screen in a lightweight package with a great keyboard and solid specs. It's not the fasted on the block, but it was never designed to be. It's great for light gaming: just don't expect max specs on the latest games. The battery life seems to top out at about 5-6 hours, which is quite acceptable for a laptop this size."
"POSITIVE", "I'll cut to the chase: the ability to swap components, including a second GPU, is a terrific feature. The dual 650m SLI gives you around the same horsepower as a single GTX 485m/580m/675m (when the 650ms are OC'ed to normal 650m levels) for a far cheaper cost. The design is nice and understated, a good departure for the Xtreme dorm-room, shiny-object designs of most other gaming laptops."
"POSITIVE", "Still running strong without a hitch. Stays crazy stable and temperatures are always cool even after hours of gaming. Beautiful screen."
"POSITIVE", "Outperforms my Vishera 8350 8-core w/ Gtx 770 PC. On sale for 999.99."
"POSITIVE", "Fast, quiet and runs cool. Not a gamer, but wanted a laptop that would do any thing that I wanted it to do. Put a SSD and it speeded up a bunch."
"POSITIVE", "This is a beautiful laptop. Very powerful, plays all games I play with ease on high settings. I thought the sound was pretty good for a laptop. The screen was crisp and could be viewed from the sides pretty well. Brightly lit rooms were not a problem either. It came with very little bloatware, at least in terms of programs. I don't use the Metro side of Windows 8, so there may be lots of bloaty apps."
"POSITIVE", "Great specs, thin and light, works properly."
"POSITIVE", "Design, speed, look, price, internal components."
"POSITIVE", "This is definitely an ultrabook in its feel. It is just a shade under the mac book air in class and feel. In fact at first glance you will confuse the two. It definitly has a sturdy feel to it, and I love the trackpad and keyboard. The specs are better, the intel 4000 HD is a nice inclusion, and played HD videos with zero problems. The usb 3 port is on one side, and the usb 2 port is on the other. They are clearly marked, and positioned well. If you are looking for an ultrabook that is more powerful spec wise then the mac book air, yet half the price this is perfect."
"POSITIVE", "newegg forced me to write something here. I don't have any pros to offer however."
"POSITIVE", "price, size"
"POSITIVE", "nice look"
"POSITIVE", "arrived fast , thanks to Newegg"
"POSITIVE", "Worked perfectly right out of the box. Easy setup that took only minutes. This thing runs so quiet, if it didn't have that awesome blue glow I would forget it was there! And games run perfectly smooth on high settings. After looking through other stores in town for a good pc in my price range, I gave up and looked online and found this monster, and for the same price as most other less powerful systems! This leaves my previous pc whimpering in the corner. I Highly recommend this system to anyone looking for a serious upgrade from their old pc."
"POSITIVE", "I just got this today and it worked perfectly right out of the box. Setup is easy and takes minutes. Shipping across country took 4 days and thats a good thing.. I went to Staples and a few other stores to buy a new pc, and they were out of every pc in my price range, so i took a look online and found this. I guess it was destiny. Compared to my previous pc (hp compaq, 2.5gigs of ram, and 250gig HDD) this is beastly. I haven't tried gaming on it yet but soon will. And for the price...how can you beat it?! It looks cool and runs silent. Best money I ever spent...so far. We'll see in a few weeks of running this machine."
"POSITIVE", "Really solid specs - runs LoL at 60+ FPS on highest settings, handles BF3 on high as well (doesn't quite get there on Ultra settings, but I think that's to be expected), I'm able to output audio to my 5.1 system via the HDMI out on the video card which I wasn't sure was going to work at first. For some one looking to get into PC gaming, this is seems like a good place to start."
"POSITIVE", "Excellent mid/high-range PC. Runs games like Diablo 3, Sanctum 2, TF2, all on highest settings with virtually no lag. Very fast delivery- original ETA was in 4-7 days, it got to me in 3. Huge RAM capacity: I've only ever used as much as about 6 of the 16 gigs I have available. Installation was a breeze, no driver installation required. Large HD space: a total of about 900 gigs available upon reciept. Everything about this computer is a huge upgrade from the one I used to use: this is pretty much my first actual gaming computer, and so far I am very satisfied. EXCELLENT price for the quality; I got it at $630 (not sure what the going rate will be from day to day). Keyboard and mouse are decent, however I recommend an upgrade if you are planning on doing serious gaming. All-around great computer. Highly recommended."
"POSITIVE", "Great laptop, specs are awesome"
"POSITIVE", "amazingly fast, nice display"
"POSITIVE", "Great laptop, runs games amazing. Quiet and the screen is gorgeous"
"POSITIVE", "Very powerful processor, decent video card, backlit keyboard, solid, sturdy design, all at a reasonable price."
"POSITIVE", "..."
"POSITIVE", "Compact & light laptop, slim design and looks good. Price was good for what your getting (suppose to get)."
